{
  "name": "my-module",
  "engineVersion": "v0.15.2",
  "sdk": "go",
  "dependencies": [
    {
      "name": "containerd",
      "source": "github.com/levlaz/daggerverse/containerd@abcd1a95cef14ad336ca21a9ab836869582617bb",
      "pin": "abcd1a95cef14ad336ca21a9ab836869582617bb"
    }
  ],
  "source": "."
}
